{
  "schema_version": "artel.family_learning_case.v1",
  "case_id": "demo_metal_cabinet_001",
  "product": "ARTEL",
  "visibility": "public_demo",
  "task": {
    "title": "Металлический шкаф управления для каталога Revit-семейств",
    "family_category": "Оборудование",
    "family_name": "ARTEL_DEMO_MetalCabinet",
    "goal": "Сделать параметрическое Revit-семейство шкафа управления для повторного использования в проектах.",
    "constraints": [
      "Типоразмеры 600x400x200 и 800x600x250 мм",
      "Дверь должна быть отдельной управляемой геометрией",
      "Каталожные параметры обязательны перед публикацией"
    ]
  },
  "source_summaries": [
    {
      "kind": "task_brief",
      "summary": "Заказчик просит типовое семейство шкафа с материалом корпуса, монтажным основанием и понятной карточкой каталога."
    },
    {
      "kind": "rfa_review",
      "summary": "Первичная версия не прошла проверку из-за пустого ADSK_Наименование и отсутствующего кода изделия."
    }
  ],
  "specification": {
    "types": ["600x400x200", "800x600x250"],
    "geometry": "Параметрический корпус, дверь, ручка, монтажная панель и условное обозначение. Размеры управляются типами.",
    "materials": ["Окрашенная сталь", "Пластик ручки"],
    "parameters": [
      {
        "name": "ADSK_Наименование",
        "value_or_rule": "Шкаф управления металлический",
        "group": "Каталог"
      },
      {
        "name": "ADSK_КодИзделия",
        "value_or_rule": "ARTEL-DEMO-CABINET-{type}",
        "group": "Каталог"
      },
      {
        "name": "МатериалКорпуса",
        "value_or_rule": "Окрашенная сталь",
        "group": "Материалы"
      }
    ]
  },
  "parameter_profile": {
    "fop_profile": "ARTEL_DEMO_FOP_v1",
    "required_shared_parameters": [
      "ADSK_Наименование",
      "ADSK_КодИзделия",
      "ADSK_Марка",
      "ADSK_Примечание"
    ]
  },
  "validation_report": {
    "status": "accepted_with_notes",
    "checks": [
      "Все типоразмеры открываются без ошибок",
      "Обязательные shared parameters заполнены",
      "Каталожная карточка содержит назначение и поисковые теги"
    ],
    "known_failures": [
      "Пустой ADSK_Наименование приводит к неинформативному каталогу",
      "Отсутствующий ADSK_КодИзделия мешает связать семейство со спецификацией"
    ],
    "fixes": [
      "Заполнить ADSK_Наименование на уровне типа",
      "Сформировать ADSK_КодИзделия по правилу ARTEL-DEMO-CABINET-{type}",
      "Добавить теги: шкаф, управление, оборудование, металл"
    ]
  },
  "catalog_card": {
    "display_name": "Шкаф управления металлический",
    "category": "Оборудование",
    "tags": ["шкаф", "управление", "оборудование", "металл"],
    "search_terms": [
      "металлический шкаф",
      "шкаф управления",
      "Revit family",
      "RFA catalog",
      "ADSK_Наименование"
    ]
  },
  "acceptance": {
    "outcome": "accepted_with_notes",
    "accepted_by_role": "BIM coordinator",
    "notes": "Кейс годится как public-safe seed для проверки ARTEL_Index и retrieval по похожим RFA задачам."
  }
}
